<?xml version="1.0" encoding="UTF-8"?>
<happening xmlns:xsi="http://www.w3.org/2001/XMLSchema-instance" xsi:noNamespaceSchemaLocation="happening.xsd" idPrefix="iv">
    <stream id="Dh2011" name="Schnellzug Zeidel-Cité d'Orcive-Kvirasim">
        <event id="ZDKV01">
            <eventBody>
                <image lang="all">kvirasim/events/ZDKV01.jpg</image>
                <text>
               <de>
                    Du besteigst den Liegewagen nach Kvirasim und schläfst sofort nach Bezug deiner Kabine ein. Es ist 
                    viel mehr passiert, als an so manchen Tagen in deinem studentischen Leben. Die neue Welt, die 
                    eigentlich keine neue Welt ist, sie sieht ja so aus, wie die Erde, aber irgendwie doch ganz anders ...
                    Mit diesem Gefühl wachst du auf, als es in Cité d'Orcive plötzlich heißt: "Alle aussteigen!" Wie gut, 
                    dass du dem Schaffner zugehört hast, als er dir sagte, dass du in den Internight 045 umsteigen musst ...
                    Du schaust dich etwas in der Stadt um, kannst den Bahnhof aber nicht verlassen - denn auch hier befindet 
                    sich eine Analysestadt im Bau.
                </de>
            <fr>Tu montes la voiture couchette vers Kvirasim et endors tout de suite après avoir pris ta cabine. Beaucoup plus s'est passé comme à des autres jours dans ta vie d'étudiante. Ce nouveau monde qui n'en est pas franchement, il a l'air de la Terre, mais est complètement autre... Tu te reveilles avec ce sentiment quand à Cité d'Orcive, on crie : « Tout le monde descend ! » Bien que tu as écouté à l'agent raccompagnant quand il t'a dit(e) qu'il te faut changer dans l'Intercités de nuit 045... Tu regardes un peu dans la ville mais ne peux pas quitter la gare - parce que ici aussi, on construit une ville d'analyse.</fr><en>You board the couchette coach to Kvirasim and fall asleep right after having taken your compartment. So much more things happened like on other days in your student life. The new world which is actually no new world looks like Earth but is something completely else ... you wake up with exactly that felling in Cité d'Orcive when suddenly, someone shouts: "Everyone get off!" How well you did when you paid attention to the conductor when he said to you that you have to change to the Internight 045 ... you look a bit around in the town but cannot leave the station – as here too, an analysis city is under construction.</en></text>
            </eventBody>
            <nextEvent pointRef="ZDKV02"/>
        </event>
        <event id="ZDKV02">
            <eventBody>
                <image lang="all">kvirasim/events/ZDKV02.jpg</image>
                <text>
               <de>
                    Nach einer endlos langen Wartezeit besteigst du den Liegewagen im Internight 045 nach Kvirasim. Und 
                    nach mehrtägiger Fahrt kommst du in der Stadt der Phonetik und der Phonologie an. Diese Stadt hat sich 
                    dem Studienkomplex Phonetik + Phonologie gewidmet und die Fächer sind versorgt, die in diesem Studienmodul 
                    angeboten werden. Besteige die Linie U11, um zu sehen, was dich dort erwartet.
                </de>
            <fr>Après un temps semblablement infini, tu montes la voiture couchettes dans l'Intercités de nuit 045 à Kvirasim. Et après un voyage de plusieurs jours, tu arrives dans la ville de la phonétique et de la phonologie. Cette ville s'est consacrée au complex d'études phonétique + phonologie et ces matières sont servies qu'on offre dans ce module d'études. Monte la ligne U11 pour voir ce qui t'y attend.</fr><en>After a seemingly endless waiting time, you board the couchette coach of the Internight 045 to Kvirasim. And after a journey of several days, you arrive in the city of phonetics and phonology. This city consecrated itself to the phonetics and phonology study complex and those subjects are served which are offered in that study module. Board line U11 to see what awaits you there.</en></text>
            </eventBody>
            <exitStream>
                <nextCity>kvirasim</nextCity>
                <nextStation>1</nextStation>
                <nextPlace>hbf_platform6_7a</nextPlace>
            </exitStream>
        </event>
    </stream>
    <stream id="Dh153" name="Schnellzug Darborough-Karlstadt">
        <event id="ZDKA00">
            <eventMultimedia>
                <baseFile>voyage/voyage_Dh153_Bmee_0.mp4</baseFile>
                <setImages>
                    <assocData dataType="image" filePath="karlstadt/ChristianGarveAntonGraff.jpg"/>
                    <assocData dataType="image" filePath="karlstadt/EdmundBurke1771.jpg"/>
                    <assocData dataType="image" filePath="karlstadt/Elisabeth_von_Staegemann_Selbstportraet_1808.jpg"/>
                    <assocData dataType="image" filePath="karlstadt/Friedrich_Gentz.jpg"/>
                    <assocData dataType="image" filePath="karlstadt/Jean_Pierre_Frederic_Ancillon_Rinck.jpg"/>
                    <assocData dataType="image" filePath="karlstadt/Kant_gemaelde_1.jpg"/>
                    <assocData dataType="image" filePath="karlstadt/TEI-400.jpg"/>
                    <assocData dataType="image" filePath="karlstadt/kvag_zeidel_diesel_ng_542_2.png"/>
                    <assocData dataType="image" filePath="karlstadt/kvag_zeidel_diesel_nl_202_2.png"/>
                    <assocData dataType="image" filePath="karlstadt/RolleDesFahrkartenautomaten.jpg"/>
                </setImages>
                <imgInterval>10</imgInterval>
            </eventMultimedia>
            <exitStream>
                <nextCity>karlstadt</nextCity>
                <nextStation>1</nextStation>
                <nextPlace>Dh153_arrival</nextPlace>
            </exitStream>
        </event>
    </stream>
</happening>
